"5,1,1,3,5,1,5",n,"29000,29000,29000,29000,29000,25000,29000","4,2,2,2,2,2"
"5,1,3,4,4,4,5","1,2,5,6,4,3,7","40000,23164,35193,20409,23481,48181,17316","7780,12440,6247,6376,5120,6100,6708",A2K4OJDQPXIU5T,Laptop,25 - 31,Cable network,na,"4,4,4,4,4,4,4"
"5,1,2,1,1,1,1","1,2,5,3,7,4,6","69426,41263,40069,73602,42356,44429,69965","10063,19516,10706,10250,9368,9578,7471",A2R75YFKVALBXE,Laptop,60 and above,WiFi,"Stalls are usually the worst for me, completely lifting me out of the simulation of reality; a little bit of blur I can live with if they don't completely obscure the image. Guidelines are clear, nothing confusing, and the side-by-sides are helpful, especially in distinguishing the more subtle changes in blur.","2,4,5,5,5,5,5"
"5,1,1,1,1,1,1","1,2,6,5,4,3,7","30631,33982,25434,23407,23872,26312,21079","11249,15461,6131,7633,4793,5056,4923",A3ODGLELT1TPX,Desktop,25 - 31,Cable network,play ground in player was video difrent,"2,2,2,2,2,2,2"
"5,1,2,2,1,2,2","1,2,5,3,4,6,7","92846,78932,76479,63159,65651,59510,48837","13352,15035,9496,11973,19741,11619,29611",A1TKGFJSMVR2RP,Laptop,46 - 52,WiFi,Impairments at beginning time are more annoying than the impairment at the end time. I am little confused about my grading because it was very difficult notice the blurr when the videos are not focussed or zoom in. Side by side comparison is somewhat helpful but I prefer to watch full screen.,"2,5,4,4,5,4,4"
"5,1,1,3,4,2,2","1,2,6,4,5,7,3","78231,48805,49102,65549,67105,69644,49740","27382,32549,12912,43468,18265,86327,37737",A3RU8J5I8NMKPD  ,Laptop,32 - 38,Cellular network,NO...GUIDELINE IS NOT CLEAR BECAUSE CONFUSING ON GRADED.,"2,5,4,4,4,4,4"
"5,1,1,1,1,1,1","1,2,3,4,7,6,5","45403,53292,64238,44401,35726,42575,41146","7490,6774,7590,15482,7435,6317,7301",A226S9LUL53Q01,Laptop,25 - 31,WiFi,It was clear. But the impairments were all the same.,"2,4,4,4,4,4,4"
"5,1,2,2,2,2,1","1,2,6,5,4,3,7","84352,58482,88984,48915,68598,70705,86893","17557,54924,12498,23599,37882,30553,20633",A3FYPNNCB7IQ1P,Desktop,25 - 31,Cable network,Stallings are not acceptable in such sports oriented streams/videos as it takes away the excitement.,"2,5,4,4,4,4,5"
"5,1,5,5,5,4,3","1,2,3,7,5,4,6","184256,19057,13288,12012,13107,13822,12724","5189,9345,6394,5455,8735,5563,6157",A20HST24WOFP10,Desktop,18 - 24,WiFi,none,"5,5,5,5,5,5,5"
"5,1,1,1,1,1,1","1,2,7,3,6,5,4","54169,42635,37383,36630,35298,36107,70115","9070,51256,11147,6116,7320,6620,13426",A3U42WL6MGNSAU,Laptop,25 - 31,WiFi,"Pauses were very disruptive. I'm axious when the video pause. Blur is ok. I'm not confuse with the grading. No side by side is confuse, it's better split","2,4,4,4,4,4,4"
"5,1,4,2,3,2,4","1,2,3,5,6,4,7","66872,29154,48237,55314,42032,51149,50126","7850,8700,8751,10077,14942,22832,10972",A3IDRQ3JS6XZZ8,Computador portátil,18 - 24,Wi-fi,Não estou confusa quanto as classificação. As diferenças prejudicam devido ao tempo de paralisação. A comparação lado a lado só foi necessário no primeiro vídeo,"2,5,5,5,5,5,5"
"5,1,3,2,2,2,3","1,2,4,3,7,5,6","68451,44555,43238,48262,42228,43132,44717","10202,9726,4499,6612,4018,5813,4707",AHKOW1B4BF0F2,Laptop,18 - 24,WiFi,The impairments are more annoying if they appear in the middle of the video. The guideline was clear. The side-by-side comparison was very helpful,"2,4,4,4,4,4,4"
"5,1,1,3,3,3,3","1,2,3,4,5,7,6","198698,53270,54854,49770,51140,45686,53873","8690,10692,15527,14650,9992,9603,8051",A1IMRSDQ7RO9US,Laptop,25 - 31,Cable network,i gave the review based on the video quality like blur and stalling.,"2,4,4,4,4,4,4"
"5,1,4,4,4,4,4","1,2,7,3,6,4,5","96170,92027,106819,73834,49985,177302,99494","16968,42873,13839,10027,9346,10440,14859",ACDUS37H0IXDQ,Laptop,32 - 38,WiFi,"I understood the experiment, and the quality of the video really influences the overall experience a lot, but what bothered me most were the pauses and crashes it really is irritating regardless of the quality of the video.","2,4,4,4,4,4,4"
"5,1,4,3,4,3,4","1,2,4,6,3,5,7","132935,59859,87431,92041,103636,59117,125688","36980,25922,13386,19024,19524,12731,7751",A2EARNRMFJOSIY,Laptop,25 - 31,WiFi,side by side comparison helps me more,"2,4,4,4,4,4,4"
"5,1,2,2,4,2,4","1,2,3,7,5,4,6","50973,77456,35138,34239,34789,89350,34513","10049,15463,10035,12147,12253,5513,6815",A8DMLATJZOF4Q,Desktop,25 - 31,WiFi,"Side-by-side reference is a must have for impairments like blur, for stal I think it's not completely necessary. There were some impairments that were mid play, these were very annoying, either live or during replay. There were a couple of them that were during parts where the players were either celebrating the goal or just after the ball goes out of the pitch, these were not that annoying.","2,4,4,4,4,4,4"
"5,1,3,2,4,3,3","1,2,3,5,6,7,4","64234,39037,35708,35942,37148,38348,36176","5773,9262,16386,6331,8439,4191,39885",A397QMUM40C4SH,Desktop,25 - 31,WiFi,"nothing was confusing to me, i watch a lot of video's online so i know what good quality and bad quality looks like.","2,5,4,5,3,5,5"
"5,1,4,4,4,4,5","1,2,4,6,3,5,7","98523,51719,41506,40462,51232,41391,41750","24397,21350,7973,27089,6210,11429,5732",A37M4OVE9R80G,Laptop,25 - 31,WiFi,some times only it was strucked over all not bad,"2,2,4,4,4,4,2"
"5,1,5,1,1,1,1","1,2,3,4,7,6,5","224999,54952,69516,47842,42025,39505,46738","8570,18740,6874,8982,7528,9313,8283",A1D76KWT5QX4RP,Desktop,32 - 38,Cable network,Yeah it was different experience. I really enjoyed it. And the experimental guidelines was clear . I don't get any confusion the grading. The side by side comparison is helps to grade the video and I don't need to look at the reference again. Thank you,"2,4,2,4,5,4,4"
"5,1,3,5,5,5,5","1,2,5,7,6,4,3","99348,80769,49492,43822,138777,46989,71150","25751,12558,7409,7433,10643,6107,39813",A1NN049RUZ4D2K,Laptop,60 and above,WiFi,good,"3,4,3,2,3,2,2"
"5,1,3,4,4,5,4","1,2,7,5,6,3,4","217461,161838,985738,118007,460680,690898,179390","22319,18825,6622,7749,6560,8282,7228",A3K8WQICXRO3F8,Laptop,32 - 38,WiFi,no,"5,5,5,5,5,5,5"
"5,1,4,2,4,3,4","1,2,4,6,7,5,3","195736,65086,18794,66400,18744,44120,19869","10907,33545,6859,11295,6092,6331,6591",A2N2V517FVOBVZ,Laptop,25 - 31,Cable network,good,"5,4,4,4,4,4,4"
"5,1,5,5,5,5,5","1,2,3,4,6,7,5","82428,46176,54701,45277,53868,44266,43589","30359,30282,12766,9266,8192,8020,7757",A32HSV4E6VGE36,Laptop,60 and above,WiFi,good survey,"2,2,2,2,2,2,2"
"5,1,2,3,2,2,3","1,2,3,6,5,7,4","99837,63240,102335,142884,57355,47757,61673","26278,21208,95483,12714,4671,6617,22450",A22TYEGRHFUFQJ,Laptop,25 - 31,WiFi,"the guideline was very clear, the timestamp is very important for example when the player is shooting live is not like on replay, since it is more annoying at crucial moments of the video, side-by-side comparison was not helpful compared to watch the video on a separate view.","2,4,4,4,4,4,4"
"5,1,2,2,2,2,2","1,2,3,6,5,7,4","46586,59962,83563,39121,56192,44357,46395","10341,27102,19257,8562,6561,10137,42457",A24Z3GWWZ8JUTM,Desktop,25 - 31,WiFi,"It was most annoying when it happened in moments of tension (ball in front of enemy goal). Experiment guideline was clear, but i was a bit worried that i missed the blur, because i did not grade any video as blurred. I cross referenced with the test video but could not find any blur.","2,5,4,4,4,4,4"
"5,1,4,3,1,1,4","1,2,3,6,7,4,5","78823,48614,78775,55707,47772,56062,56765","28260,20026,13808,15743,17653,12697,27997",A6KEHDNT925VQ,Desktop,25 - 31,WiFi,The impairments affected me when specific moments of the video that were crucial to watch were spoiled. I did not needed the reference to change my thoughts on the grading. The guidelines were completely clear to me.,"2,4,4,4,4,4,4"
"5,1,2,2,2,1,2","1,2,7,5,4,6,3","61032,38214,46508,71765,74290,72298,44880","12455,12171,4846,5059,6868,5757,5190",AFIK3VBMMX6G6,Laptop,32 - 38,Cable network,"All contained stalls between 2-3.5 seconds. Timing of the stall made a big impact, such as when scoring","2,4,4,4,4,4,4"
"5,1,4,3,3,3,3","1,2,6,3,5,7,4","13556,11945,28228,13105,33769,33415,31419","4626,4308,6987,4730,7129,5772,7148",AAY0F6L5N4TXR,Desktop,18 - 24,WiFi,"instructions were clear, side to side comparisons werent helpful","2,5,2,4,4,4,4"
"5,1,4,4,4,4,4","1,2,6,7,3,4,5","68349,42064,42263,46682,45366,56029,48496","14034,28858,10795,8557,12618,23416,20790",ADSHAJ3Z2YDWS,Desktop,25 - 31,WiFi," I didn't notice much difference, between one video and another, except for less saturation and for a brief pause. Repeat the video, I think it was not necessary. Thank you for participating in the survey.","2,2,2,2,4,2,2"
"5,1,5,1,1,5,1","1,2,4,7,5,6,3","20490,10401,12523,13624,10843,16842,10932","7077,5468,7811,5463,6949,6495,4995",A2D4RMKLUQ6RZA,Laptop,25 - 31,Cable network,IN THE VIDEO REVIED,"2,2,2,2,2,2,2"
"5,1,3,3,4,3,3","1,2,5,3,4,6,7","73751,66630,59552,67125,57930,54033,68626","9547,7931,7007,6990,44266,6875,8378",A1I25A84DUJLI,Laptop,25 - 31,Cable network,ENGLISH IS COMFORTABLE LANGUAGE. NO CONFUSION IN GRADING. ,"2,5,2,2,2,4,5"
"5,1,5,5,5,3,5","1,2,6,4,7,5,3","54411,39971,62304,63786,63575,67688,63448","12194,20997,10334,24993,9989,34949,15767",APC7FSVEKRIGT,Laptop,32 - 38,WiFi,"the impairments of ""stall"" in annoying only when the action is near the goalkeeper","2,4,4,4,4,4,4"
"5,1,2,3,3,3,3","1,2,7,6,4,3,5","56845,46060,35758,35411,36585,35615,36742","4850,6305,9167,5357,8332,5370,9184",A1EGQAMPW9N5FT,Desktop,25 - 31,WiFi,"When the impairment happen in a crucial moment, like when someone is to shoot, is more annoying","2,5,4,4,4,4,4"
"5,1,1,1,1,1,1","1,2,3,6,4,5,7","75669,48701,69331,73395,0,68771,102359","14972,34302,44398,23923,71633,9850,122381",A29RR6SV0L4D8C,Laptop,25 - 31,Cellular network,the experiment guideline was clear,"2,4,4,5,5,5,5"
"5,1,1,1,1,1,1","1,2,3,6,5,4,7","101540,38312,38123,35766,39159,39573,39213","4181,5173,3783,4207,4733,6829,4453",A34YKQXWOMUZRC,Desktop,39 - 45,Cable network,Everything is very clear.,"2,4,4,4,4,4,4"
"5,1,1,1,1,1,1","1,2,3,7,6,4,5","63980,40856,44968,57179,67756,79108,68677","26965,44911,17832,12076,13887,8122,10039",A3EHE32S5AS1I1,Desktop,25 - 31,Cable network,"I think the reference is no longer needed. For me, the stalling is completely annoying whenever it occurs, because when it occurs once, it will happen again (frequently), hence i´m expecting for it and therefore not enjoying.","2,4,4,4,4,4,4"
",,,,,,","1,2,3,4,6,5,7","0,0,0,0,0,0,0","0,0,0,0,0,0,0",A3TLL0KRD80A5Z,Laptop,25 - 31,WiFi,"I feel the impairments at the beginning of a reply is fine but an impairment like ""Stall"" for more than couple of seconds is very annoying. Impairments during crucial moments like passing of the ball from one player to another, or moments just before scoring of a goal can ruin the whole experince. ",",,,,,,"
"5,1,5,1,5,5,5","1,2,4,7,3,6,5","76534,59855,57297,68009,68997,63547,73442","19146,26544,24155,31259,20297,11613,34169",A96HQDKRSAZZT,Laptop,18 - 24,WiFi,Yes,"2,4,2,2,2,2,2"
"5,1,3,3,2,3,3","1,2,6,5,4,3,7","77573,65791,78614,63706,66738,63015,63190","7279,9039,6522,5322,6430,7930,10888",A1GV1WGA3W6CLG,Desktop,53 - 59,WiFi,Impairments at moments of suspense or excitement are much more annoying than those at other times. Do not need side-by-side reference.,"2,4,4,4,5,4,4"
"5,1,3,3,3,5,3","1,2,4,3,7,5,6","41896,36017,36532,36096,36738,36113,33993","4367,10168,7951,28636,5984,4684,8121",A253S5S5GWG94P,Desktop,18 - 24,Cable network,yes,"2,4,4,4,4,2,4"
"5,1,4,5,4,4,2","1,2,5,4,7,6,3","349660,52058,60091,47794,48117,103591,43313","7044,7161,7018,8118,5027,4727,7509",A2KWEVSI7P1RGQ,Laptop,25 - 31,Cable network,none,"2,5,2,2,2,2,2"
"5,1,1,1,1,1,1","1,2,3,7,6,5,4","26760,18650,37492,18315,17064,23073,16309","20032,7887,15122,4774,6155,14072,5631",A36SUOEMOIXFSO,Laptop,25 - 31,Cable network,yes,"2,2,2,2,2,2,2"
"5,1,4,4,4,4,4","1,2,3,7,4,5,6","63733,265273,38770,40845,37365,36450,37450","373808,16395,8550,7600,6500,8281,9583",AU581RHK5J8L4,Desktop,25 - 31,Cable network,The main objective of this study is to assess the effect of video games on ... Our findings show that visual memory results were slightly better in the playing group. ... There are many studies that could show that the use of video games is an ... without any prior cognitive function impairment or chronic disease.,"2,2,2,2,4,4,4"
"5,1,1,1,1,1,1","1,2,5,7,4,6,3","37379,36619,12949,33011,34266,34902,35608","4391,29780,4753,3263,4438,4663,4902",AL24FY41FE1J7,Desktop,18 - 24,Cable network,"the stalling impairment is more annyoing than the blur impairment for me, because it just breaks the climax of the video. I am not confused about the grading. the side-by-side comparison helps me at the beginning, but after a few tests I don't need it anymore. ","2,2,4,4,4,4,4"
"5,1,1,1,1,1,1","1,2,5,7,4,6,3","67130,58556,30690,63523,73166,215160,63868","10533,24630,9607,7063,6100,10406,6411",A2FEWB3KWM7KX7,Laptop,25 - 31,WiFi,"The test is very clear, I was able to understand quickly. Having a better quality video helps to understand the mistakes of the second. The second is made worse by knowing what a good quality is like.","2,4,4,4,4,4,4"
"5,1,1,1,5,1,1","1,2,6,4,5,3,7","45293,36082,12616,22699,27449,38598,24340","4910,11893,5810,5150,4908,5230,4821",A182N7RLXGSCZG,Desktop,25 - 31,WiFi,"survey is clear to me. If a videos stop mid ways, people might get annoyed. Side by side comparison does help me grade.","2,4,4,4,2,4,4"
"5,1,4,2,3,2,2","1,2,5,3,4,7,6","80393,48577,52870,47294,329640,40332,46727","19500,10229,10190,14485,16857,9052,11939",ACBG07QLGIDP0,Laptop,25 - 31,WiFi,"I think the stalling bad experience is highly dependent on the timestamp it occurs. I didn't see any blurring on the videos I was supposed to grade but in general, it was pretty straightforward. On the last question, I think it's important to have the reference video available to check. Not always necessary, but sometimes it is, so leave it available. One more thing. Give more time to the conclusion of the task. I did this one before, with the blurr impairment, and lost the reward because it took me more than 20min to finish the task and answer this final question. The task is very interesting by the way.","2,4,4,4,4,4,4"
"5,1,1,1,1,1,1","1,2,6,4,3,5,7","168004,326461,45815,53934,54818,60427,32521","40935,17161,4285,6821,4077,9879,3561",A305USYDAJUGI7,Desktop,39 - 45,Cable network,"It was very clear, and it was easy for me to give grades by wacthing side-by-side comparison.","2,4,4,4,4,4,4"
"5,1,5,5,5,5,5","1,2,4,5,7,3,6","69985,40770,92645,51491,81022,41181,38459","15181,9432,7750,4807,4569,4759,6184",A2MDHOD643AW1K,Laptop,25 - 31,Cable network,Thank you,"2,2,2,2,2,2,2"
"5,1,3,2,2,2,3","1,2,3,6,7,5,4","63488,57245,38651,36840,37803,51857,36127","12691,10028,19722,11513,9704,12839,13769",A14YT4Q8ZT8GYJ,Laptop,25 - 31,WiFi,"It's annoying when something important it's going on at the video. it's clear. no confuse. Don't think I should look at the reference again, It's enough. ","2,4,4,4,4,4,5"
"5,1,5,5,5,5,5","1,2,6,7,4,3,5","241385,105874,42066,37300,37665,109742,39069","43659,27579,7196,9315,5539,7573,5997",A392XBUSSNVGRU,Desktop,25 - 31,Cable network,Nothing,"2,5,5,5,5,5,5"
"5,1,5,4,5,4,1","1,2,3,5,6,4,7","63376,51082,29313,99978,80306,75606,150642","5846,84129,13979,7438,13235,9836,19787",A6FFJG03FFRAL,Laptop,18 - 24,WiFi,None,"5,4,5,5,5,5,4"
"5,5,4,4,4,4,5","1,2,7,4,5,6,3","95545,0,71665,71419,71243,73387,116307","34140,13883,18338,25795,43694,20466,49813",AEPK8XRFCD0OI,Área de Trabalho,18 - 24,Wi-fi, Side-by-side comparison helps to make a better analysis of details,"2,2,4,4,4,4,2"
"5,1,1,1,1,1,1","1,2,3,4,6,7,5","41251,16741,26093,21563,26365,23783,17088","10486,11500,11815,7699,10237,7312,6734",AYMJAMX7Z7YHG,Desktop,25 - 31,Cable network,none,"2,2,2,2,2,2,2"
